{"schema_version":"1.0.0","protocol_version":"1.2","mode":"guarded","allowed_surfaces":["skills","routing"],"core_policy":"requires-human","budgets":{"reviews_per_agent_day":1,"experiments_per_agent_day":1,"promotions_per_agent_day":1},"evidence":{"persist_raw_content":false,"max_ephemeral_excerpts":4,"max_excerpt_bytes":2048,"retention_days":30},"evaluation":{"minimum_replays":3,"minimum_candidate_wins":2,"blind_judge":true,"critical_regressions_allowed":0},"canary":{"eligible_tasks":5,"maximum_days":7,"task_regressions_before_rollback":2}}
